<?xml version="1.0" encoding="UTF-8"?>
<xs:schema xmlns:xs="http://www.w3.org/2001/XMLSchema">

  <xs:element name="llibres">
    <xs:complexType>
      <xs:sequence>
        <xs:element name="llibre" maxOccurs="unbounded">
          <xs:complexType>
            <xs:sequence>
              <xs:element name="titol" type="xs:string"/>
              <xs:element name="autor" type="xs:string"/>
              <xs:element name="preu" type="xs:decimal"/>
            </xs:sequence>
          </xs:complexType>
        </xs:element>
      </xs:sequence>
    </xs:complexType>
  </xs:element>

</xs:schema>