<?xml version="1.0" encoding="UTF-8"?>
<llibres
  xmlns:xsi="http://www.w3.org/2001/XMLSchema-instance"
  xsi:noNamespaceSchemaLocation="llibres.xsd">
  <llibre>
    <titol>Clean Code</titol>
    <autor>Robert C. Martin</autor>
    <preu>32</preu>
  </llibre>
  <llibre>
    <titol>Effective Java</titol>
    <autor>Joshua Bloch</autor>
    <preu>45</preu>
  </llibre>
</llibres>